,Unnamed: 0,timestamp,screen_name,replay_to_users,replies,retweets,likes,text,geo,mentions,hashtags,user_id,tweet_url,city_id,city,lat,lng
1525,1525,2019-10-31 17:41:01,DirtyMike53,,0,0,0,"“Ugh..Khakis” Apparently Mike from Quicken and Jake from State Farm are the same person @Detroit, Michigan https://www.instagram.com/p/B4SpPCJnifoNJ5fC4R2Fon6fYp-Otv8dBldkJY0/?igshid=pjyne1ejkqx0",,,[],1189960480007344128,https://twitter.com/DirtyMike53/status/1189960480007344128,1840003978,Grosse Pointe Park,42.3794,-82.9288
1526,1526,2019-10-26 22:33:33,ChrisMeller67,,0,0,0,@StateFarm I'm sorry but your commercials are just so bad.,,@StateFarm,[],1188222160998936577,https://twitter.com/ChrisMeller67/status/1188222160998936577,1840003978,Grosse Pointe Park,42.3794,-82.9288
1527,1527,2019-10-25 01:30:32,benanholzer,,0,0,0,With @PatrickMahomes out this Sunday the Chiefs have signed the State Farm Agent for a 1 game contract. Ironically his contract covered home and auto.,,@PatrickMahomes,[],1187541921213964288,https://twitter.com/benanholzer/status/1187541921213964288,1840003978,Grosse Pointe Park,42.3794,-82.9288
1528,1528,2019-10-15 14:23:31,MLDBanks,,0,0,1,"I'm going to switch my car insurance from Geico to Allstate, then to Statefarm, then back to Geico. If my calculations are correct, they should owe me $837.",,,[],1184112571277828098,https://twitter.com/MLDBanks/status/1184112571277828098,1840003978,Grosse Pointe Park,42.3794,-82.9288
1529,1529,2019-10-15 03:12:45,SomeCallMeCap,kellierowe,0,0,2,That's actually him doing the State Farm commercials live while he waits for the middle of the field to open up ,,,[],1183943767692365825,https://twitter.com/SomeCallMeCap/status/1183943767692365825,1840003978,Grosse Pointe Park,42.3794,-82.9288
1530,1530,2019-09-27 02:43:38,IceColdBrewLou,,0,0,1,Who ever is in charge of making the @StateFarm commercials should be fired immediately they suck so much ass..,,@StateFarm,[],1177413460226969601,https://twitter.com/IceColdBrewLou/status/1177413460226969601,1840003978,Grosse Pointe Park,42.3794,-82.9288
1531,1531,2019-09-20 02:41:03,BigPaksView,,0,0,2,Absolutely nobody: Takashi69: The husband burned down Sheryl's she shed #takashi69 #Snitch9ine #SnitchNine #JimJones #CardiB #BigPaksView #StateFarm,,,takashi69 Snitch9ine SnitchNine JimJones CardiB BigPaksView StateFarm,1174876091489705986,https://twitter.com/BigPaksView/status/1174876091489705986,1840003978,Grosse Pointe Park,42.3794,-82.9288
1532,1532,2019-09-09 02:03:10,willibchillin10,,0,0,0,Bullaro’s conquer two titles this weekend SIJ mushball tournament Men’s & Co-Ed champs with pit stop to Travis burger with charger cup #StateFarm”TomPeck” #Finger-Licking Gud… https://www.instagram.com/p/B2LEkchHIsIZ7SFrlkOJGuIBExt96qyTKYYLIs0/?igshid=8wa2xveme5cj,,,StateFarm Finger,1170880292392976384,https://twitter.com/willibchillin10/status/1170880292392976384,1840003978,Grosse Pointe Park,42.3794,-82.9288
1533,1533,2019-08-25 17:23:35,RiotJynx,,6,51,398,Yesterday was an exciting day 1 of the #LCS Finals! Such amazing cosplayers and judges at the @StateFarm cosplay contest too. – at Little Caesars Arena,,@StateFarm,LCS LCS,1165676106747449349,https://twitter.com/RiotJynx/status/1165676106747449349,1840003978,Grosse Pointe Park,42.3794,-82.9288
1534,1534,2019-08-25 17:09:34,Riotswimbananas,,4,9,152,"Happy #LCS finals! I'll be wondering around with the @StateFarm cosplay contest finalists in my blood moon Sivir, so come say hi! Who do you want to win? #C9WIN or #TLWIN ? Blade and mask made by @MrShiftyCloak #cosplay #LeagueOfLegends – at Little Caesars Arena",,@StateFarm @MrShiftyCloak,LCS LCS C9WIN C9WIN TLWIN TLWIN cosplay LeagueOfLegends,1165672579501178880,https://twitter.com/Riotswimbananas/status/1165672579501178880,1840003978,Grosse Pointe Park,42.3794,-82.9288
1535,1535,2019-08-15 23:28:46,tatar_tot,dan__radcliff,0,0,0,"$500 deductible, travis and I get a student discount, my dad gets a loyal customer discount through state farm, and his credit score discount, full coverage on everything",,,[],1162144129146675200,https://twitter.com/tatar_tot/status/1162144129146675200,1840003978,Grosse Pointe Park,42.3794,-82.9288
1536,1536,2019-07-16 20:14:36,sermcminn,DesignationSix,0,0,1,State Farm is not the greatest either! ,,,[],1151223628257779713,https://twitter.com/sermcminn/status/1151223628257779713,1840003978,Grosse Pointe Park,42.3794,-82.9288
1537,1537,2019-07-12 03:46:23,KaraokeMattSays,,0,0,0,Well that's going to be the end of the CP3 and Harden State Farm commercials no question about that,,,[],1149525385408761856,https://twitter.com/KaraokeMattSays/status/1149525385408761856,1840003978,Grosse Pointe Park,42.3794,-82.9288
1538,1538,2019-06-21 00:49:45,Jaxson313,,0,0,1,"Whoops! Everybody speeds on I-94, State Farm. If I went 55, I’d get run over. #Detroit #Autobahn #motorcity #cantstopwontstop",,,Detroit Autobahn motorcity cantstopwontstop,1141870789874130944,https://twitter.com/Jaxson313/status/1141870789874130944,1840003978,Grosse Pointe Park,42.3794,-82.9288
1539,1539,2019-06-02 16:27:08,UdoCurrency,,0,0,0,I just entered to win a trip to the 2019 NBA Draft presented by State Farm thanks to @lids &amp; @NewEraCap #LidsSweeps,,@lids @NewEraCap,LidsSweeps,1135221320000688128,https://twitter.com/UdoCurrency/status/1135221320000688128,1840003978,Grosse Pointe Park,42.3794,-82.9288
1540,1540,2019-05-01 23:25:47,MelissaRWilson1,,0,0,0,"This event at eMagine Royal Oak has been so fun! From the Red Carpet, to the mini-interview to the free pinball! The program has been very inspiring as well. Thanks DADA & Statefarm! #couragouspersuaders #statefarm",,,couragouspersuaders statefarm,1123730262733590529,https://twitter.com/MelissaRWilson1/status/1123730262733590529,1840003978,Grosse Pointe Park,42.3794,-82.9288
1541,1541,2019-04-20 21:31:44,typfrederick,,0,0,2,I can’t believe Oscar left Dunder Mifflin for State Farm....,,,[],1119715293885083648,https://twitter.com/typfrederick/status/1119715293885083648,1840003978,Grosse Pointe Park,42.3794,-82.9288
1542,1542,2019-03-31 20:46:25,ChadLivengood,,2,3,3,"—> @StateFarm, with over 1 million policies in Michigan, was the most-sued auto insurance company in Oakland County in 2018 with 440 lawsuits. Insurance companies in general won’t talk about these suits or their actions that often trigger them. https://www.crainsdetroit.com/crains-forum/courtroom-collisions-no-fault-lawsuits-flood-oakland-county-courts #MiNoFault",,@StateFarm,MiNoFault,1112456135100063745,https://twitter.com/ChadLivengood/status/1112456135100063745,1840003978,Grosse Pointe Park,42.3794,-82.9288
1543,1543,2019-03-29 23:53:42,JakeFrohriep,Eugene_Scott,1,0,3,“What’s your name?” “Jake.” “Oh like from State Farm!?” “Yep..” “Are you wearing khakis!?” “Please just take my order” ,,,[],1111778488980332544,https://twitter.com/JakeFrohriep/status/1111778488980332544,1840003978,Grosse Pointe Park,42.3794,-82.9288
1544,1544,2019-03-28 02:45:16,tobiasroberts,GovWhitmer,0,0,0,"When asked by Chairperson @LanaTheis what were the suggested strategies to reduce drivers’ premiums, they [State Farm] cited reducing fraud, putting caps on family provided attendant care and fee schedules. They did not mention PIP Choice. @ProtectNoFault",,@LanaTheis @ProtectNoFault,[],1111096889758400513,https://twitter.com/tobiasroberts/status/1111096889758400513,1840003978,Grosse Pointe Park,42.3794,-82.9288
1545,1545,2019-03-18 19:29:29,ChocStarr,,0,0,0,I love my job! I’m such a big kid! I love doing random stuff like this!!!! I had a ball at the game yesterday! Pretty cool! Lol #DetroitPistons #Detroit #Pistons #StateFarm @… https://www.instagram.com/chocstarr313/p/BvKU1IhlP8J/?utm_source=ig_twitter_share&amp;igshid=ifisyfeekfyg,,,DetroitPistons Detroit Pistons StateFarm,1107725732417921024,https://twitter.com/ChocStarr/status/1107725732417921024,1840003978,Grosse Pointe Park,42.3794,-82.9288
1546,1546,2019-12-21 03:02:15,echill4692,,1,0,0,"I have yet to receive my updated proof of insurance docs, even though my curent policy expires tomorrow. I called State Farm to discover that a chunk of customers have all called in about not having received updated docs from their agents. No one knows why though lol. Anyway...",,,[],1208221111126831104,https://twitter.com/echill4692/status/1208221111126831104,1840003982,Highland Park,42.4052,-83.0977
1547,1547,2019-12-21 02:53:37,echill4692,,0,0,0,"My updated proof of car insurance hasn’t yet arrived in the mail, and my current policy docs expire tomorrow. So, I called State Farm to find out that a lot of customers have been reaching out due to not receiving their docs.",,,[],1208218939630800900,https://twitter.com/echill4692/status/1208218939630800900,1840003982,Highland Park,42.4052,-83.0977
1548,1548,2019-12-20 21:00:58,__MaryEllen,,0,0,0,"Warren human sex trafficking sting finds prostitutes forced to sell drugs among the people arrested included a @StateFarm Insurance agent, an @OnStar technician, an employee of @BankofAmerica and a student https://www.freep.com/story/news/local/michigan/wayne/2019/12/20/warren-human-trafficking-sting-finds-prostitutes-forced-sell-drugs/2708060001/ via @freep",,@StateFarm @OnStar @BankofAmerica @freep,[],1208130194315366405,https://twitter.com/__MaryEllen/status/1208130194315366405,1840003982,Highland Park,42.4052,-83.0977
1549,1549,2019-11-25 20:44:38,wombang,gib723,0,0,2,And all of America would finally be free of those horrific State Farm commercials...,,,[],1199066386129133570,https://twitter.com/wombang/status/1199066386129133570,1840003982,Highland Park,42.4052,-83.0977
1550,1550,2019-11-24 21:51:18,TaitBrown,joncoopertweets,0,0,0,"Better get Geico, All State and State Farm Insurance, Rudy. ",,,[],1198720776280662016,https://twitter.com/TaitBrown/status/1198720776280662016,1840003982,Highland Park,42.4052,-83.0977
1551,1551,2019-10-31 17:41:01,DirtyMike53,,0,0,0,"“Ugh..Khakis” Apparently Mike from Quicken and Jake from State Farm are the same person @Detroit, Michigan https://www.instagram.com/p/B4SpPCJnifoNJ5fC4R2Fon6fYp-Otv8dBldkJY0/?igshid=pjyne1ejkqx0",,,[],1189960480007344128,https://twitter.com/DirtyMike53/status/1189960480007344128,1840003982,Highland Park,42.4052,-83.0977
1552,1552,2019-10-26 22:33:33,ChrisMeller67,,0,0,0,@StateFarm I'm sorry but your commercials are just so bad.,,@StateFarm,[],1188222160998936577,https://twitter.com/ChrisMeller67/status/1188222160998936577,1840003982,Highland Park,42.4052,-83.0977
1553,1553,2019-10-25 01:30:32,benanholzer,,0,0,0,With @PatrickMahomes out this Sunday the Chiefs have signed the State Farm Agent for a 1 game contract. Ironically his contract covered home and auto.,,@PatrickMahomes,[],1187541921213964288,https://twitter.com/benanholzer/status/1187541921213964288,1840003982,Highland Park,42.4052,-83.0977
1554,1554,2019-10-15 14:23:31,MLDBanks,,0,0,1,"I'm going to switch my car insurance from Geico to Allstate, then to Statefarm, then back to Geico. If my calculations are correct, they should owe me $837.",,,[],1184112571277828098,https://twitter.com/MLDBanks/status/1184112571277828098,1840003982,Highland Park,42.4052,-83.0977
1555,1555,2019-10-15 03:20:23,jjrondo77,,0,0,0,Hey @AaronRodgers12 nice game! Make sure you pay them refs with that @StateFarm money cheating bitch,,@AaronRodgers12 @StateFarm,[],1183945688532602881,https://twitter.com/jjrondo77/status/1183945688532602881,1840003982,Highland Park,42.4052,-83.0977
1556,1556,2019-10-15 03:12:45,SomeCallMeCap,kellierowe,0,0,2,That's actually him doing the State Farm commercials live while he waits for the middle of the field to open up ,,,[],1183943767692365825,https://twitter.com/SomeCallMeCap/status/1183943767692365825,1840003982,Highland Park,42.4052,-83.0977
1557,1557,2019-10-15 02:39:39,B_warner3,,0,0,0,Too bad @StateFarm can’t get that ball back for Aaron Rodgers,,@StateFarm,[],1183935439536824321,https://twitter.com/B_warner3/status/1183935439536824321,1840003982,Highland Park,42.4052,-83.0977
1558,1558,2019-09-28 21:40:30,BrianBullard94,TheWifeYouLove,1,0,3,Does State Farm cover that shit?,,,[],1178061948451205121,https://twitter.com/BrianBullard94/status/1178061948451205121,1840003982,Highland Park,42.4052,-83.0977
1559,1559,2019-09-27 02:43:38,IceColdBrewLou,,0,0,1,Who ever is in charge of making the @StateFarm commercials should be fired immediately they suck so much ass..,,@StateFarm,[],1177413460226969601,https://twitter.com/IceColdBrewLou/status/1177413460226969601,1840003982,Highland Park,42.4052,-83.0977
1560,1560,2019-09-20 02:41:03,BigPaksView,,0,0,2,Absolutely nobody: Takashi69: The husband burned down Sheryl's she shed #takashi69 #Snitch9ine #SnitchNine #JimJones #CardiB #BigPaksView #StateFarm,,,takashi69 Snitch9ine SnitchNine JimJones CardiB BigPaksView StateFarm,1174876091489705986,https://twitter.com/BigPaksView/status/1174876091489705986,1840003982,Highland Park,42.4052,-83.0977
1561,1561,2019-09-18 15:02:40,J_CHUE,RianH2120,1,0,0,Except they didn’t.. said there’s no note in my account stating the renters was to be canceled.. they can reimburse me for only 30 days... aka $15.08. Looking for a new insurance company as we speak ,,,[],1174337952429826053,https://twitter.com/J_CHUE/status/1174337952429826053,1840003982,Highland Park,42.4052,-83.0977
1562,1562,2019-09-18 13:27:37,J_CHUE,,1,0,2,Just realized @StateFarm has been charging us for renters insurance and homeowners insurance.. we told them we were moving out of the apartment and to cancel our renters the day we added the homeowners policy.. 2.5y ago I pray for whomever answers the phone when my wife calls ,,@StateFarm,[],1174314031429115904,https://twitter.com/J_CHUE/status/1174314031429115904,1840003982,Highland Park,42.4052,-83.0977
1563,1563,2019-09-17 21:04:38,TobiasFolf,,2,0,5,Did I just hear a State Farm Radio Commercial covering Ginuwine’s “Pony”? Guess I’d rather hear that than the Summit Place Kia Commercials. ,,,[],1174066657108606976,https://twitter.com/TobiasFolf/status/1174066657108606976,1840003982,Highland Park,42.4052,-83.0977
1564,1564,2019-09-09 02:03:10,willibchillin10,,0,0,0,Bullaro’s conquer two titles this weekend SIJ mushball tournament Men’s & Co-Ed champs with pit stop to Travis burger with charger cup #StateFarm”TomPeck” #Finger-Licking Gud… https://www.instagram.com/p/B2LEkchHIsIZ7SFrlkOJGuIBExt96qyTKYYLIs0/?igshid=8wa2xveme5cj,,,StateFarm Finger,1170880292392976384,https://twitter.com/willibchillin10/status/1170880292392976384,1840003982,Highland Park,42.4052,-83.0977
1565,1565,2019-08-25 17:23:35,RiotJynx,,6,51,398,Yesterday was an exciting day 1 of the #LCS Finals! Such amazing cosplayers and judges at the @StateFarm cosplay contest too. – at Little Caesars Arena,,@StateFarm,LCS LCS,1165676106747449349,https://twitter.com/RiotJynx/status/1165676106747449349,1840003982,Highland Park,42.4052,-83.0977
1566,1566,2019-08-25 17:09:34,Riotswimbananas,,4,9,152,"Happy #LCS finals! I'll be wondering around with the @StateFarm cosplay contest finalists in my blood moon Sivir, so come say hi! Who do you want to win? #C9WIN or #TLWIN ? Blade and mask made by @MrShiftyCloak #cosplay #LeagueOfLegends – at Little Caesars Arena",,@StateFarm @MrShiftyCloak,LCS LCS C9WIN C9WIN TLWIN TLWIN cosplay LeagueOfLegends,1165672579501178880,https://twitter.com/Riotswimbananas/status/1165672579501178880,1840003982,Highland Park,42.4052,-83.0977
1567,1567,2019-08-15 23:28:46,tatar_tot,dan__radcliff,0,0,0,"$500 deductible, travis and I get a student discount, my dad gets a loyal customer discount through state farm, and his credit score discount, full coverage on everything",,,[],1162144129146675200,https://twitter.com/tatar_tot/status/1162144129146675200,1840003982,Highland Park,42.4052,-83.0977
1568,1568,2019-07-16 20:14:36,sermcminn,DesignationSix,0,0,1,State Farm is not the greatest either! ,,,[],1151223628257779713,https://twitter.com/sermcminn/status/1151223628257779713,1840003982,Highland Park,42.4052,-83.0977
1569,1569,2019-07-12 03:46:23,KaraokeMattSays,,0,0,0,Well that's going to be the end of the CP3 and Harden State Farm commercials no question about that,,,[],1149525385408761856,https://twitter.com/KaraokeMattSays/status/1149525385408761856,1840003982,Highland Park,42.4052,-83.0977
1570,1570,2019-06-21 00:49:45,Jaxson313,,0,0,1,"Whoops! Everybody speeds on I-94, State Farm. If I went 55, I’d get run over. #Detroit #Autobahn #motorcity #cantstopwontstop",,,Detroit Autobahn motorcity cantstopwontstop,1141870789874130944,https://twitter.com/Jaxson313/status/1141870789874130944,1840003982,Highland Park,42.4052,-83.0977
1571,1571,2019-06-20 16:49:58,Jaxson313,wxyzdetroit,0,1,1,How about a credit on my ridiculously high insurance premium post haste @StateFarm ,,@StateFarm,[],1141750045416595456,https://twitter.com/Jaxson313/status/1141750045416595456,1840003982,Highland Park,42.4052,-83.0977
1572,1572,2019-06-02 16:27:08,UdoCurrency,,0,0,0,I just entered to win a trip to the 2019 NBA Draft presented by State Farm thanks to @lids &amp; @NewEraCap #LidsSweeps,,@lids @NewEraCap,LidsSweeps,1135221320000688128,https://twitter.com/UdoCurrency/status/1135221320000688128,1840003982,Highland Park,42.4052,-83.0977
1573,1573,2019-05-05 22:08:42,HeyLookItsJacob,,1,0,1,"WHY DID MY CAR INSURANCE INCREASE NEARLY 100 DOLLARS IN ONE MONTH @StateFarm This hurts me so much, its already a struggle as it is...",,@StateFarm,[],1125160415045083138,https://twitter.com/HeyLookItsJacob/status/1125160415045083138,1840003982,Highland Park,42.4052,-83.0977
1574,1574,2019-05-01 23:25:47,MelissaRWilson1,,0,0,0,"This event at eMagine Royal Oak has been so fun! From the Red Carpet, to the mini-interview to the free pinball! The program has been very inspiring as well. Thanks DADA & Statefarm! #couragouspersuaders #statefarm",,,couragouspersuaders statefarm,1123730262733590529,https://twitter.com/MelissaRWilson1/status/1123730262733590529,1840003982,Highland Park,42.4052,-83.0977
1575,1575,2019-04-20 21:31:44,typfrederick,,0,0,2,I can’t believe Oscar left Dunder Mifflin for State Farm....,,,[],1119715293885083648,https://twitter.com/typfrederick/status/1119715293885083648,1840003982,Highland Park,42.4052,-83.0977
1576,1576,2019-03-31 20:46:25,ChadLivengood,,2,3,3,"—> @StateFarm, with over 1 million policies in Michigan, was the most-sued auto insurance company in Oakland County in 2018 with 440 lawsuits. Insurance companies in general won’t talk about these suits or their actions that often trigger them. https://www.crainsdetroit.com/crains-forum/courtroom-collisions-no-fault-lawsuits-flood-oakland-county-courts #MiNoFault",,@StateFarm,MiNoFault,1112456135100063745,https://twitter.com/ChadLivengood/status/1112456135100063745,1840003982,Highland Park,42.4052,-83.0977
1577,1577,2019-03-29 23:53:42,JakeFrohriep,Eugene_Scott,1,0,3,“What’s your name?” “Jake.” “Oh like from State Farm!?” “Yep..” “Are you wearing khakis!?” “Please just take my order” ,,,[],1111778488980332544,https://twitter.com/JakeFrohriep/status/1111778488980332544,1840003982,Highland Park,42.4052,-83.0977
1578,1578,2019-03-28 02:45:16,tobiasroberts,GovWhitmer,0,0,0,"When asked by Chairperson @LanaTheis what were the suggested strategies to reduce drivers’ premiums, they [State Farm] cited reducing fraud, putting caps on family provided attendant care and fee schedules. They did not mention PIP Choice. @ProtectNoFault",,@LanaTheis @ProtectNoFault,[],1111096889758400513,https://twitter.com/tobiasroberts/status/1111096889758400513,1840003982,Highland Park,42.4052,-83.0977
1579,1579,2019-03-18 19:29:29,ChocStarr,,0,0,0,I love my job! I’m such a big kid! I love doing random stuff like this!!!! I had a ball at the game yesterday! Pretty cool! Lol #DetroitPistons #Detroit #Pistons #StateFarm @… https://www.instagram.com/chocstarr313/p/BvKU1IhlP8J/?utm_source=ig_twitter_share&amp;igshid=ifisyfeekfyg,,,DetroitPistons Detroit Pistons StateFarm,1107725732417921024,https://twitter.com/ChocStarr/status/1107725732417921024,1840003982,Highland Park,42.4052,-83.0977
1580,1580,2019-12-21 03:02:15,echill4692,,1,0,0,"I have yet to receive my updated proof of insurance docs, even though my curent policy expires tomorrow. I called State Farm to discover that a chunk of customers have all called in about not having received updated docs from their agents. No one knows why though lol. Anyway...",,,[],1208221111126831104,https://twitter.com/echill4692/status/1208221111126831104,1840002441,Farmington,42.4614,-83.3784
1581,1581,2019-12-21 02:53:37,echill4692,,0,0,0,"My updated proof of car insurance hasn’t yet arrived in the mail, and my current policy docs expire tomorrow. So, I called State Farm to find out that a lot of customers have been reaching out due to not receiving their docs.",,,[],1208218939630800900,https://twitter.com/echill4692/status/1208218939630800900,1840002441,Farmington,42.4614,-83.3784
1582,1582,2019-12-20 21:00:58,__MaryEllen,,0,0,0,"Warren human sex trafficking sting finds prostitutes forced to sell drugs among the people arrested included a @StateFarm Insurance agent, an @OnStar technician, an employee of @BankofAmerica and a student https://www.freep.com/story/news/local/michigan/wayne/2019/12/20/warren-human-trafficking-sting-finds-prostitutes-forced-sell-drugs/2708060001/ via @freep",,@StateFarm @OnStar @BankofAmerica @freep,[],1208130194315366405,https://twitter.com/__MaryEllen/status/1208130194315366405,1840002441,Farmington,42.4614,-83.3784
1583,1583,2019-11-29 02:55:12,BeauBourgeois,,0,0,1,I miss my bmw man. Why did state farm have to scam me,,,[],1200246804782170113,https://twitter.com/BeauBourgeois/status/1200246804782170113,1840002441,Farmington,42.4614,-83.3784
1584,1584,2019-11-25 22:31:30,FenixAmmunition,,4,15,53,"Unless this means ""Jake from State Farm"" is in the kitchen strapped and ready, she has to be the dumbest person on Earth. @DLoesch @MAJTOURE @MrColionNoir #nevergofullpotato #progun #stupiditypersonified #2A",,@DLoesch @MAJTOURE @MrColionNoir,nevergofullpotato progun stupiditypersonified 2A,1199093280509767680,https://twitter.com/FenixAmmunition/status/1199093280509767680,1840002441,Farmington,42.4614,-83.3784
1585,1585,2019-11-25 20:44:38,wombang,gib723,0,0,2,And all of America would finally be free of those horrific State Farm commercials...,,,[],1199066386129133570,https://twitter.com/wombang/status/1199066386129133570,1840002441,Farmington,42.4614,-83.3784
1586,1586,2019-11-16 18:49:50,JML_16RT,,0,0,2,Those State Farm ads with Aaron Rodgers and Pat Mahomes are brutal and not funny in the slightest,,,[],1195776006151380993,https://twitter.com/JML_16RT/status/1195776006151380993,1840002441,Farmington,42.4614,-83.3784
1587,1587,2019-11-12 03:49:34,saybow1969,,0,0,0,@StateFarm please stop with the lame ass FB commercials. That dude is NOT funny. Sucks bad.,,@StateFarm,[],1194099894941818883,https://twitter.com/saybow1969/status/1194099894941818883,1840002441,Farmington,42.4614,-83.3784
1588,1588,2019-11-12 03:43:41,saybow1969,,0,0,0,@ESPNNFL Please stop with State Farm commercials. The guy is worse actor then AR. Steve Carell rip off act so old and lame and just bad. Not even 1 lucky funny one.,,@ESPNNFL,[],1194098411781468161,https://twitter.com/saybow1969/status/1194098411781468161,1840002441,Farmington,42.4614,-83.3784
1589,1589,2019-10-17 22:18:16,Romsus,,1,0,0,all the new state farm commercials are some of the worst i've seen. they advertise NOTHING,,,[],1184956823830487042,https://twitter.com/Romsus/status/1184956823830487042,1840002441,Farmington,42.4614,-83.3784
1590,1590,2019-10-15 03:20:23,jjrondo77,,0,0,0,Hey @AaronRodgers12 nice game! Make sure you pay them refs with that @StateFarm money cheating bitch,,@AaronRodgers12 @StateFarm,[],1183945688532602881,https://twitter.com/jjrondo77/status/1183945688532602881,1840002441,Farmington,42.4614,-83.3784
1591,1591,2019-10-15 02:39:39,B_warner3,,0,0,0,Too bad @StateFarm can’t get that ball back for Aaron Rodgers,,@StateFarm,[],1183935439536824321,https://twitter.com/B_warner3/status/1183935439536824321,1840002441,Farmington,42.4614,-83.3784
1592,1592,2019-10-13 15:43:50,saybow1969,,0,0,0,"@nflnetwork There anyway can STOP playing these lame ass State Farm commericials!? “Did we just have a break threw?” That dude flat out sucks and is not funny, but who writing shit that makes no sense at all, but trying to make up an inside joke that is no we’re in site! Brutal!",,@nflnetwork,[],1183408006433824768,https://twitter.com/saybow1969/status/1183408006433824768,1840002441,Farmington,42.4614,-83.3784
1593,1593,2019-10-11 03:31:33,saybow1969,,0,0,0,"@StateFarm Enough with this douche bag!! Commercials are so stupid and that ass CANT act and is NOT funny!! Black haired tool who acts like Steve Carell. That ass, if not sure!! Witch ass talking about",,@StateFarm,[],1182498949376155651,https://twitter.com/saybow1969/status/1182498949376155651,1840002441,Farmington,42.4614,-83.3784
1594,1594,2019-09-28 21:40:30,BrianBullard94,TheWifeYouLove,1,0,3,Does State Farm cover that shit?,,,[],1178061948451205121,https://twitter.com/BrianBullard94/status/1178061948451205121,1840002441,Farmington,42.4614,-83.3784
1595,1595,2019-09-27 02:44:57,saybow1969,,0,0,0,@NFLonFOX PLEASE quit playing those dumb ass State Farm commercials! That tool using the Steve Carrel routine is so damn lame!! Every single one he in!! HE SUCKS!!!,,@NFLonFOX,[],1177413791971184641,https://twitter.com/saybow1969/status/1177413791971184641,1840002441,Farmington,42.4614,-83.3784
1596,1596,2019-09-27 02:43:38,IceColdBrewLou,,0,0,1,Who ever is in charge of making the @StateFarm commercials should be fired immediately they suck so much ass..,,@StateFarm,[],1177413460226969601,https://twitter.com/IceColdBrewLou/status/1177413460226969601,1840002441,Farmington,42.4614,-83.3784
